{
  "version": 1,
  "story_id": "FIXTURE-MIN",
  "generated_at": "2026-07-26T20:00:00Z",
  "provider": "local-hash",
  "nodes": [
    { "id": "story-1", "type": "story", "ref": "FIXTURE-MIN" },
    { "id": "ac-1", "type": "ac", "ref": "AC-001" },
    { "id": "artifact-1", "type": "artifact", "ref": "tests/fixtures/proof-graph/artifacts/hello.txt" },
    { "id": "hash-1", "type": "content-hash", "ref": "tests/fixtures/proof-graph/artifacts/hello.txt", "sha256": "1608559e640e61125004b032ad27a5e2304d5233506596e05a5ae0273c2e6382" },
    { "id": "cmd-1", "type": "command-run", "ref": "echo fixture-verify", "exit_code": 0 },
    { "id": "snap-1", "type": "repo-snapshot", "sha": "95afdc5ba8e7d6d770324e3d0bc4af364cadfd08" }
  ],
  "edges": [
    { "from": "story-1", "to": "ac-1", "type": "references" },
    { "from": "artifact-1", "to": "hash-1", "type": "content-of" },
    { "from": "cmd-1", "to": "artifact-1", "type": "verified-by" }
  ]
}
